{
  "suite": "trouble",
  "dataset": "trouble.m1",
  "ts": "2025-08-02T21:13:17.055709Z",
  "counts": {
    "total": 20,
    "ok": 13
  },
  "metrics": {
    "latency_ms": {
      "p50": 0.044,
      "p95": 4.887,
      "p99": 4.887,
      "avg": 0.288
    },
    "pass_min_steps": 1.0,
    "deterministic": 1.0
  },
  "failures": [
    {
      "id": "T2",
      "reason": "Missing required keywords: ['exstart']"
    },
    {
      "id": "T4",
      "reason": "Missing required keywords: ['bgp', 'session']"
    },
    {
      "id": "T5",
      "reason": "Missing required keywords: ['interface', 'status']"
    },
    {
      "id": "T11",
      "reason": "Missing required keywords: ['bgp', 'ttl', 'multihop']"
    },
    {
      "id": "T12",
      "reason": "Missing required keywords: ['bgp', 'ttl', 'multihop']"
    },
    {
      "id": "T15",
      "reason": "Missing required keywords: ['bgp', 'timers', 'keepalive']"
    },
    {
      "id": "T16",
      "reason": "Missing required keywords: ['bgp', 'policy', 'route']"
    }
  ],
  "hashes": {
    "dataset_sha256": "b5d4eb9ec260cbceec0487d0b1d7b5f645ec9d2e275670166fc41b8fccac9ffe",
    "code_rev": "701dfcf"
  }
}